{
  "detail": {
    "payload": {
      "command": [
        "cargo",
        "fmt",
        "--all",
        "--",
        "--check"
      ],
      "returncode": 0,
      "stderr": "",
      "stdout": ""
    }
  },
  "event_sequence": 2,
  "event_type": "task.output",
  "execution_id": "chatgpt-node-fmt2-20260828T2004Z",
  "occurred_at": "2026-08-28T19:56:16Z",
  "recorded_at": "2026-08-28T19:56:35Z",
  "schema": "zero3.commander.event/2.0",
  "task_id": "pilot-task-5023129456664dcc"
}
