{
  "detail": {
    "payload": {
      "command": [
        "git",
        "apply",
        "--whitespace=nowarn",
        "/opt/zero3-pilot-dev/tmpm0jgi20b.patch"
      ],
      "returncode": 0,
      "stderr": "",
      "stdout": ""
    }
  },
  "event_sequence": 2,
  "event_type": "task.output",
  "execution_id": "chatgpt-computer-serde-fix-20260828T2010Z",
  "occurred_at": "2026-08-28T20:01:06Z",
  "recorded_at": "2026-08-28T20:01:06Z",
  "schema": "zero3.commander.event/2.0",
  "task_id": "pilot-task-692dbe923f174a40"
}
