{
  "detail": {
    "payload": {
      "returncode": 0
    }
  },
  "event_sequence": 3,
  "event_type": "task.succeeded",
  "execution_id": "chatgpt-contract-push-20260828T2011Z",
  "occurred_at": "2026-08-28T20:11:10Z",
  "recorded_at": "2026-08-28T20:11:28Z",
  "schema": "zero3.commander.event/2.0",
  "task_id": "pilot-task-0c9cc738f6784dcc"
}
