{
  "detail": {
    "payload": {
      "reason": "command failed with exit 101: ['cargo', 'build', '--workspace', '--all-targets']\nstderr:\n    Updating crates.io index\n     Locking 9 packages to latest compatible versions\n      Adding fallible-iterator v0.3.0\n      Adding fallible-streaming-iterator v0.1.9\n      Adding foldhash v0.1.5\n      Adding hashbrown v0.15.5\n      Adding hashlink v0.10.0\n      Adding libsqlite3-sys v0.35.0\n      Adding pkg-config v0.3.34\n      Adding rusqlite v0.37.0 (available: v0.40.2)\n      Adding vcpkg v0.2.15\n Downloading crates ...\n  Downloaded cc v1.4.4\n  Downloaded fallible-streaming-iterator v0.1.9\n  Downloaded foldhash v0.1.5\n  Downloaded find-msvc-tools v0.1.11\n  Downloaded fallible-iterator v0.3.0\n  Downloaded hashlink v0.10.0\n  Downloaded hashbrown v0.15.5\n  Downloaded pkg-config v0.3.34\n  Downloaded libsqlite3-sys v0.35.0\n  Downloaded rusqlite v0.37.0\n  Downloaded shlex v2.0.1\n  Downloaded vcpkg v0.2.15\n   Compiling shlex v2.0.1\n   Compiling find-msvc-tools v0.1.11\n   Compiling cc v1.4.4\n   Compiling pkg-config v0.3.34\n   Compiling vcpkg v0.2.15\n   Compiling foldhash v0.1.5\n   Compiling hashbrown v0.15.5\n   Compiling libsqlite3-sys v0.35.0\n   Compiling zero3-providers v0.1.0 (/opt/zero3-pilot-dev/crates/zero3-providers)\nerror[E0596]: cannot borrow `session.browser` as mutable, as `session` is not declared as mutable\n   --> crates/zero3-providers/src/browser.rs:258:13\n    |\n258 | /             session\n259 | |                 .browser\n    | |________________________^ cannot borrow as mutable\n    |\nhelp: consider changing this to be mutable\n    |\n250 |         let mut session = self\n    |             +++\n\nFor more information about this error, try `rustc --explain E0596`.\nerror: could not compile `zero3-providers` (lib) due to 1 previous error\nwarning: build failed, waiting for other jobs to finish...\n"
    }
  },
  "event_sequence": 3,
  "event_type": "task.failed",
  "execution_id": "chatgpt-complete-build1-20260828T1752Z",
  "occurred_at": "2026-08-28T17:49:52Z",
  "recorded_at": "2026-08-28T17:49:59Z",
  "schema": "zero3.commander.event/2.0",
  "task_id": "pilot-task-5a8b8f0e279c487b"
}
