{
  "detail": {
    "payload": {
      "capability": "test.clippy"
    }
  },
  "event_sequence": 1,
  "event_type": "task.started",
  "execution_id": "chatgpt-node-clippy1-20260828T2005Z",
  "occurred_at": "2026-08-28T19:56:56Z",
  "recorded_at": "2026-08-28T19:56:56Z",
  "schema": "zero3.commander.event/2.0",
  "task_id": "pilot-task-fcf12f85de284474"
}
