{
  "detail": {
    "payload": {
      "command": [
        "git",
        "-c",
        "user.name=Zero3 Pilot Dev Executor",
        "-c",
        "user.email=zero3-pilot-dev-executor@localhost",
        "commit",
        "-m",
        "feat: complete local Pilot Node and Windows desktop shell"
      ],
      "returncode": 0,
      "stderr": "",
      "stdout": "[pilot-dev-node-desktop-20260829 7f93989] feat: complete local Pilot Node and Windows desktop shell\n 3 files changed, 2194 insertions(+), 158 deletions(-)\n"
    }
  },
  "event_sequence": 2,
  "event_type": "task.output",
  "execution_id": "chatgpt-node-commit1-20260828T2007Z",
  "occurred_at": "2026-08-28T19:58:16Z",
  "recorded_at": "2026-08-28T19:58:16Z",
  "schema": "zero3.commander.event/2.0",
  "task_id": "pilot-task-47310d9fd9bc4ae5"
}
