{
  "detail": {
    "payload": {
      "capability": "file.patch"
    }
  },
  "event_sequence": 1,
  "event_type": "task.started",
  "execution_id": "chatgpt-router-node-auto-helper-20260829T0134Z",
  "occurred_at": "2026-08-29T01:33:47Z",
  "recorded_at": "2026-08-29T01:33:47Z",
  "schema": "zero3.commander.event/2.0",
  "task_id": "pilot-task-098b99ecbc3b4059"
}
