{
  "detail": {
    "payload": {
      "command": [
        "cargo",
        "test",
        "--workspace"
      ],
      "returncode": 0,
      "stderr": "   Compiling zero3-web v0.1.0 (/opt/zero3-pilot-dev/apps/web)\n   Compiling zero3-providers v0.1.0 (/opt/zero3-pilot-dev/crates/zero3-providers)\n    Finished `test` profile [unoptimized + debuginfo] target(s) in 1.81s\n     Running unittests src/lib.rs (target/debug/deps/zero3_core-0fff12ff36793601)\n     Running unittests src/lib.rs (target/debug/deps/zero3_memory-2c105831a9123749)\n     Running unittests src/lib.rs (target/debug/deps/zero3_providers-597ff2ec12758dae)\n     Running unittests src/bin/fake_ocu.rs (target/debug/deps/fake_ocu-eed87e428e4f86e5)\n     Running unittests src/bin/fake_ocu_hang.rs (target/debug/deps/fake_ocu_hang-88c938b44540565f)\n     Running tests/browser_real.rs (target/debug/deps/browser_real-915a00c454597d29)\n     Running tests/open_computer_use.rs (target/debug/deps/open_computer_use-2aa9bcab6131e3e1)\n     Running tests/open_computer_use_real.rs (target/debug/deps/open_computer_use_real-295ed24f35c192f0)\n     Running unittests src/lib.rs (target/debug/deps/zero3_scheduler-7fec3c2403589e65)\n     Running tests/event_store_integration.rs (target/debug/deps/event_store_integration-2e00e3bb04224d81)\n     Running unittests src/lib.rs (target/debug/deps/zero3_store-54e57a244a32d487)\n     Running unittests src/lib.rs (target/debug/deps/zero3_subagents-639e75d3f8c983f3)\n     Running unittests src/main.rs (target/debug/deps/zero3_web-055f5802bdcd95b8)\n   Doc-tests zero3_core\n   Doc-tests zero3_memory\n   Doc-tests zero3_providers\n   Doc-tests zero3_scheduler\n   Doc-tests zero3_store\n   Doc-tests zero3_subagents\n",
      "stdout": "\nrunning 4 tests\ntest permission::tests::insufficient_grant_on_irreversible_action_is_denied_not_escalated ... ok\ntest permission::tests::insufficient_grant_on_reversible_action_requires_approval_not_silent_allow ... ok\ntest permission::tests::sufficient_grant_always_allows_regardless_of_reversibility ... ok\ntest permission::tests::permission_levels_form_the_expected_strict_order ... ok\n\ntest result: ok. 4 passed; 0 failed; 0 ignored; 0 measured; 0 filtered out; finished in 0.00s\n\n\nrunning 3 tests\ntest tests::personal_memory_without_explicit_approval_is_rejected ... ok\ntest tests::scopes_do_not_leak_into_each_other_and_search_is_scoped ... ok\ntest tests::operational_memory_persists_across_reopen ... ok\n\ntest result: ok. 3 passed; 0 failed; 0 ignored; 0 measured; 0 filtered out; finished in 0.04s\n\n\nrunning 6 tests\ntest browser::tests::semantic_contract_has_no_chromiumoxide_types ... ok\ntest browser::tests::unimplemented_provider_never_reports_success ... ok\ntest computer::tests::unimplemented_provider_never_reports_success ... ok\ntest registry::tests::health_check_distinguishes_missing_from_unhealthy ... ok\ntest registry::tests::register_get_list ... ok\ntest registry::tests::select_finds_first_matching_capability_deterministically ... ok\n\ntest result: ok. 6 passed; 0 failed; 0 ignored; 0 measured; 0 filtered out; finished in 0.00s\n\n\nrunning 0 tests\n\ntest result: ok. 0 passed; 0 failed; 0 ignored; 0 measured; 0 filtered out; finished in 0.00s\n\n\nrunning 0 tests\n\ntest result: ok. 0 passed; 0 failed; 0 ignored; 0 measured; 0 filtered out; finished in 0.00s\n\n\nrunning 1 test\ntest real_chromium_semantic_agent_flow ... ignored, requires a real Chrome/Chromium executable\n\ntest result: ok. 0 passed; 0 failed; 1 ignored; 0 measured; 0 filtered out; finished in 0.00s\n\n\nrunning 6 tests\ntest capabilities_enumerate_against_the_live_backend ... ok\ntest a_hung_backend_times_out_instead_of_blocking_forever ... ok\ntest execute_maps_each_action_to_the_correct_real_tool_call ... ok\ntest missing_binary_fails_gracefully_not_panicking ... ok\ntest process_starts_and_the_mcp_handshake_succeeds ... ok\ntest clean_shutdown_closes_the_session ... ok\n\ntest result: ok. 6 passed; 0 failed; 0 ignored; 0 measured; 0 filtered out; finished in 1.01s\n\n\nrunning 1 test\ntest real_windows_ocu_mcp_handshake_tools_and_notepad_state ... ignored, requires real open-computer-use and a Windows desktop session\n\ntest result: ok. 0 passed; 0 failed; 1 ignored; 0 measured; 0 filtered out; finished in 0.00s\n\n\nrunning 27 tests\ntest persistent::tests::interval_schedule_advances_from_scheduled_time ... ok\ntest persistent::tests::recurring_schedule_survives_reopen ... ok\ntest tests::cancel_does_not_advance_status_when_the_log_write_fails_from_queued_or_running ... ok\ntest tests::cancel_from_queued_and_running_both_allowed ... ok\ntest tests::cancelled_from_a_terminal_state_is_corrupt_history ... ok\ntest tests::cannot_cancel_a_terminal_job ... ok\ntest tests::cannot_start_a_job_twice ... ok\ntest tests::complete_does_not_advance_status_or_output_when_the_log_write_fails ... ok\ntest tests::completed_without_running_is_corrupt_history ... ok\ntest tests::crash_tail_recovery_salvages_valid_jobs_and_surfaces_the_diagnostic ... ok\ntest tests::crash_tail_recovery_still_rejects_semantic_corruption ... ok\ntest tests::create_never_inserts_a_record_when_the_log_write_fails ... ok\ntest tests::duplicate_queued_for_same_job_id_is_corrupt_history ... ok\ntest tests::event_after_terminal_state_is_corrupt_history ... ok\ntest tests::fail_does_not_advance_status_or_error_when_the_log_write_fails ... ok\ntest tests::failed_path_records_reason ... ok\ntest tests::failed_without_running_is_corrupt_history ... ok\ntest tests::from_events_reconstructs_every_tracked_field ... ok\ntest tests::happy_path_queued_running_succeeded ... ok\ntest tests::list_is_sorted_by_creation_order ... ok\ntest tests::operations_on_unknown_job_id_fail_cleanly ... ok\ntest tests::orphan_started_event_without_prior_queued_is_corrupt_history ... ok\ntest tests::recover_reads_through_the_injected_event_log ... ok\ntest tests::session_id_flows_through_to_every_event ... ok\ntest tests::start_does_not_advance_status_when_the_log_write_fails ... ok\ntest tests::strict_recovery_rejects_a_log_with_a_crash_tail ... ok\ntest persistent::tests::once_schedule_dispatches_one_job_then_disables ... ok\n\ntest result: ok. 27 passed; 0 failed; 0 ignored; 0 measured; 0 filtered out; finished in 0.05s\n\n\nrunning 3 tests\ntest crash_tail_mode_does_not_launder_semantically_malformed_history ... ok\ntest crash_tail_recovery_salvages_durable_jobs_and_reports_exactly_one_torn_tail ... ok\ntest recovered_manager_matches_the_original_job_records_field_for_field ... ok\n\ntest result: ok. 3 passed; 0 failed; 0 ignored; 0 measured; 0 filtered out; finished in 0.05s\n\n\nrunning 9 tests\ntest tests::corrupt_line_is_reported_not_panicked ... ok\ntest tests::recoverable_replay_salvages_events_before_an_unterminated_crash_tail ... ok\ntest tests::append_then_replay_preserves_order ... ok\ntest tests::recoverable_replay_still_fails_hard_on_mid_file_corruption ... ok\ntest tests::recoverable_replay_treats_a_terminated_invalid_last_line_as_fatal_not_a_tail ... ok\ntest tests::replay_survives_reopening_the_store ... ok\ntest tests::replay_session_and_job_filter_independently ... ok\ntest tests::strict_replay_treats_a_crash_tail_as_fatal ... ok\ntest tests::valid_final_line_without_trailing_newline_is_not_flagged_as_truncated ... ok\n\ntest result: ok. 9 passed; 0 failed; 0 ignored; 0 measured; 0 filtered out; finished in 0.04s\n\n\nrunning 5 tests\ntest registry::tests::register_then_dispatch_by_name ... ok\ntest registry::tests::dispatch_to_unregistered_name_fails_cleanly ... ok\ntest workers::tests::codex_jsonl_extracts_last_agent_message ... ok\ntest workers::tests::each_worker_uses_the_documented_noninteractive_entrypoint ... ok\ntest workers::tests::missing_executable_fails_loudly ... ok\n\ntest result: ok. 5 passed; 0 failed; 0 ignored; 0 measured; 0 filtered out; finished in 0.00s\n\n\nrunning 1 test\ntest tests::health_returns_ok ... ok\n\ntest result: ok. 1 passed; 0 failed; 0 ignored; 0 measured; 0 filtered out; finished in 0.00s\n\n\nrunning 0 tests\n\ntest result: ok. 0 passed; 0 failed; 0 ignored; 0 measured; 0 filtered out; finished in 0.00s\n\n\nrunning 0 tests\n\ntest result: ok. 0 passed; 0 failed; 0 ignored; 0 measured; 0 filtered out; finished in 0.00s\n\n\nrunning 0 tests\n\ntest result: ok. 0 passed; 0 failed; 0 ignored; 0 measured; 0 filtered out; finished in 0.00s\n\n\nrunning 0 tests\n\ntest result: ok. 0 passed; 0 failed; 0 ignored; 0 measured; 0 filtered out; finished in 0.00s\n\n\nrunning 0 tests\n\ntest result: ok. 0 passed; 0 failed; 0 ignored; 0 measured; 0 filtered out; finished in 0.00s\n\n\nrunning 0 tests\n\ntest result: ok. 0 passed; 0 failed; 0 ignored; 0 measured; 0 filtered out; finished in 0.00s\n\n"
    }
  },
  "event_sequence": 2,
  "event_type": "task.output",
  "execution_id": "chatgpt-gate-test5-20260828T1936Z",
  "occurred_at": "2026-08-28T19:36:46Z",
  "recorded_at": "2026-08-28T19:37:02Z",
  "schema": "zero3.commander.event/2.0",
  "task_id": "pilot-task-f923f15795744857"
}
