{
  "detail": {
    "payload": {
      "command": [
        "git",
        "apply",
        "--whitespace=nowarn",
        "/opt/zero3-pilot-dev/tmp3085jyu3.patch"
      ],
      "returncode": 0,
      "stderr": "",
      "stdout": ""
    }
  },
  "event_sequence": 2,
  "event_type": "task.output",
  "execution_id": "chatgpt-weixin-windows-persist2-20260828T2115Z",
  "occurred_at": "2026-08-28T21:16:10Z",
  "recorded_at": "2026-08-28T21:16:10Z",
  "schema": "zero3.commander.event/2.0",
  "task_id": "pilot-task-d05cc6efc3ef4c50"
}
