{
  "detail": {
    "payload": {
      "command": [
        "cargo",
        "build",
        "--workspace",
        "--all-targets"
      ],
      "returncode": 0,
      "stderr": "   Compiling zero3-node v0.1.0 (/opt/zero3-pilot-dev/apps/node)\n   Compiling zero3-desktop v0.1.0 (/opt/zero3-pilot-dev/apps/desktop)\n    Finished `dev` profile [unoptimized + debuginfo] target(s) in 11.85s\n",
      "stdout": ""
    }
  },
  "event_sequence": 2,
  "event_type": "task.output",
  "execution_id": "chatgpt-node-build2-20260828T1955Z",
  "occurred_at": "2026-08-28T19:51:56Z",
  "recorded_at": "2026-08-28T19:52:03Z",
  "schema": "zero3.commander.event/2.0",
  "task_id": "pilot-task-3c4ee15f699141d5"
}
